{"schemaVersion":1,"revision":"2026.09.15","createdAt":"2026-09-15T00:00:00Z","sourceRegistrySha256":"aaaaaaaaaaaaaaaaaaaaaaaaaaaaaaaaaaaaaaaaaaaaaaaaaaaaaaaaaaaaaaaa","jitendexSha256":"bbbbbbbbbbbbbbbbbbbbbbbbbbbbbbbbbbbbbbbbbbbbbbbbbbbbbbbbbbbbbbbb","classifier":{"name":"conservative-lexeme-inference","version":"1.0.0"},"counts":{"lexemes":2,"classifications":2,"conflicts":0,"levels":{"N5":1,"N4":0,"N3":0,"N2":0,"N1":0,"N0":1}},"files":[{"path":"term_meta_bank_1.json","sha256":"cccccccccccccccccccccccccccccccccccccccccccccccccccccccccccccccc","bytes":120}]}
